	Straight			Left or Right Turn			Straight			Left or Right Turn			Straight		
Robot and switch position	Left Speed	Right Speed	Time	Left Speed	Right Speed	Time	Left Speed	Right Speed	Time	Left Speed	Right Speed	Time	Left Speed	Right Speed	Time
Robot Left Switch Left	-0.5	-0.5	4000	-0.5	0.5	1000	-0.5	-0.5	2000	NA	NA	NA	NA	NA	NA
Robot Right Switch Right	-0.5	-0.5	4000	0.5	-0.5	1000	-0.5	-0.5	2000	NA	NA	NA	NA	NA	NA
Robot Left Switch Right	-1	-1	3000	-0.5	0.5	1000	-1	-1	5000	-0.5	0.5	1000	-0.5	-0.5	2000
Robot Right Switch Left	-1	-1	3000	0.5	-0.5	1000	-1	-1	5000	0.5	-0.5	1000	-0.5	-0.5	2000
Robot Middle Switch Left	-0.5	-0.5	2000	0.5	-0.5	1000	-0.5	-0.5	2000	-0.5	0.5	1000	-0.5	-0.5	2000
Robot Middle Switch Right	-0.5	-0.5	2000	-0.5	0.5	1000	-0.5	-0.5	2000	0.5	-0.5	1000	-0.5	-0.5	2000
